{
  "kind": "function",
  "schema_version": "1.0",
  "function": {
    "name": "text_echo",
    "description": "Return the supplied text without external side effects.",
    "strict": true,
    "parameters": {
      "type": "object",
      "properties": {
        "text": {
          "type": "string",
          "minLength": 1
        }
      },
      "required": [
        "text"
      ],
      "additionalProperties": false
    }
  },
  "execution": {
    "mode": "read_only",
    "external_side_effects": false,
    "idempotent": true,
    "timeout_ms": 10000
  },
  "approval": {
    "required": false,
    "reason": null
  },
  "idempotency": {
    "required": false
  },
  "result": {
    "schema": {
      "type": "object",
      "properties": {
        "text": {
          "type": "string"
        }
      },
      "required": [
        "text"
      ],
      "additionalProperties": false
    }
  },
  "errors": [
    {
      "code": "invalid_input",
      "retryable": false,
      "description": "Arguments do not match the input schema."
    },
    {
      "code": "execution_failed",
      "retryable": false,
      "description": "The local handler failed."
    }
  ],
  "tests": [
    {
      "name": "minimal-valid",
      "kind": "valid",
      "input": {
        "text": "hello"
      },
      "mock_output": {
        "text": "hello"
      }
    },
    {
      "name": "unknown-field-rejected",
      "kind": "invalid",
      "input": {
        "text": "hello",
        "extra": true
      }
    }
  ]
}
